Macabre Deams,Working Class Goes to Hell,Radnička Klasa Ide U Pakao,"Serbia, Greece, Bulgaria, Montenegro, Croatia, Romania",2023,Serbian,127',Colour,Mladen Djordjevic,"Mladen Đorđević was born in Belgrade, Serbia. He has directed the features Glad (2002) and The Life and Death of a Porno Gang (2009), part of the omnibus film Equals (2014), and the documentaries Made in Serbia (05) and Vienna Hallways (2020).","Milan Stojanovic, Mladen Djordjevic",Mladen Djordjevic,Dusan Grubin,Lazar Predojev,"Tamara Krcunovic, Leon Lucev, Momo Picuric","Five years after a factory fire claimed the lives of several workers and, with them, the primary livelihood of a rural Balkan town, the plant’s union is met with a debilitating blow in their fight for reparations. Long suspected of causing the fire in order to privatize their property, the owners have succeeded in evading legal consequence and the workers are cast as ungrateful nuisances, obstinate in the face of capitalistic progress. Stoic labour leader Ceca refuses to give up hope, but her position grows tenuous when the collective begins to develop a fascination with the pagan practices of its newest member, Mija. After Mija leads the union in a ritual that belies a satanic undertone, strange occurrences begin to be reported around town, including the enigmatic manifestation of a decrepit man, seen stalking the most corrupt citizens.",Asia Premiere,,Toronto International Film Festival 2024,WORKINGCLASSGOESTOHELL_Trailer_en.mp4,"Horror, Social Impact, Global Politics",Patra Spanou,WORKINGCLASSGOESTOHELL_Mladen-Djordjevic_bw_copyrightNormanWong (1).jpg,Working Class Goes To Hell,WORKINGCLASSGOESTOHELL_poster.jpg,,,,,2024
Mission Life,Black Butterflies,Mariposas Negras,"Spain, Panama",2024,"Arabic, Bengali, English, French, Spanish",83',"Colour, Animation",David Baute,"David Baute is currently the artistic director of the MiradasDoc Documentary Film Festival. His films –Ella(s) (2010), La murga, opera popular (2014), Milagros (2018), and Climate Exodus (2020)– have been selected in various national and international festivals.","Edmon Roch, David Baute, Marc Sabe,César Zelada",Yaiza Berrocal,María Pulido,Clara Martínez Malagelada,"Laura Gómez, Bella Agossou, Miranda Gas","Tanit migrates with her children from the dry, uninhabitable region of Turkana to Nairobi. In India, Shaila leaves her small island of Ghoramara, which is shrinking due to rising sea levels, to work as a housekeeper in Dubai. And Valeria flies with her children to Paris after a hurricane destabilizes life on the French island of Saint Martin. All three women are hoping for a better life, but in their new environments are forced to deal with various forms of exploitation. Focusing on climate refugees who have lost everything due to global warming, Black Butterflies is a radical and affecting call for change.",Asia Premiere,,"Sitges International Film Festival 2024, Annecy International Animation Film Festival 2024",MN_Trailer_PinkParrot_PRORES422HQ_VO-EN_ST_241002.mp4,"Ecology, Social Impact, Global Politics",Ikiru Films,david.jpg,Black Butterflies,available on the press kit,Black Butterflies Press Kit.pdf,,,,2024
Mission Life,Dry Season,Sucho,"Czech Republic, Germany, Slovakia",2024,"Czech, English, German",112',Colour,Bohdan Sláma,"Bohdan Sláma is one of the major talents of Czech cinema. His films –The Wild Bees (2001), Something Like Happiness (2005), Country Teacher (2008), and Four Suns (2012)– have played and won awards at major international film festivals.","Pavel Strnad, Petr Oukropec, Marko Škop, Ján Meliš",Bohdan Sláma,Diviš Marek,Jan Daňhel,"Dorota Šlajerová, Tomas Sean Pšenička, Magdaléna Borová, Martin Pechlát, Marek Daniel","A quaint Czech village. Verdant fields surround a small farm where fifty-year-old Josef farms with his wife Eva and three children. Josef tries to live an alternative life and leads a Don Quixote-like struggle against the local agribusiness owned by Viktor, for whom the land is just a tool for profit. Victor shares a turbulent relationship with his recently returned son, a climate activist. As the dry summer reaches its peak, the village runs out of drinking water, leading to escalating tensions between the two families.",India Premiere,,Galway Film Fleadh 2024,Sucho_Trailer_EN subs.mp4,"Ecology, Social Impact, Technology",Negativ film productions,Dry Season - Bohdan Sláma.JPG,Stills,dry season_international_poster_web.jpg,Presskit Dry Season EN.pdf,,,,2024
Mission Life,Eastern Anthems,,"Canada, United States, Ecuador",2024,"English, French, Spanish",78',Colour,"Matthew Wolkow, Jean-Jacques Martinod","Matthew Wolkow is a filmmaker and visual artist. His works have been screened in important festivals and alternative settings across the globe. Jean-Jacques Martinod is a media artist, film curator, abyssological researcher, and clandestine anarchivist whose work has been showcased in leading festivals, museums and cinematheques. Eastern Anthems is their first feature.",Matthew Wolkow,"Matthew Wolkow, Jean-jacques Martinod",Jean-Jacques Martinod,Matthew Wolkow,,"An unfinished film is passed along from one friend to another. The dialog between them is a journey crossed by the swarming of the Great Eastern Brood X of periodical cicadas that prophetically emerge every 17 years in the United States, invoking a reflection of a post-pandemic present and our shared futures.
A road movie composed of a chorus of voices (both human and non-human), the warnings of history, and the power of nature and rebirth.",International premiere,,Camden International Film Festival 2024,https://vimeo.com/995371456,"Hybrids, Ecology",Kino Rebelde,"Jean-Jacques Martinod.jpg
Matthew Wolkow.jpg",Eastern Anthems,POSTER_EASTERN ANTHEMS.jpeg,PRESS KIT_ EASTERN ANTHEMS.pdf,,,,2024
Mission Life,"Karuara, People of the River","Karuara, La Gente Del Río",Peru,2024,"Spanish, Kukama-Kukamiria",77',Colour,"Stephanie Boyd, Miguel Araoz Cartagena","Miguel is a visual artist from Cusco, Peru. His short animation ‘And That is How The Rivers Came to Be’ was screened at more than 20 international film festivals. Stephanie has lived and worked in Peru for 27 years. Her documentaries have screened at over 100 international film festivals.","Mariluz Canaquiri Murayari, Stephanie Boyd, Leonardo Tello Imaina","Leonardo Tello Imaina, Miguel Araoz Cartagena, Stephanie Boyd",Miguel Araoz Cartagena,Fabricio Deza Iturri,Mariluz Canaquiris,"Deep in Peru’s Amazon region, the Marañón River is home to a vast network of spirit villages ruled by the Karuara, or “People of the River.” Through enchanting hand-painted animation, we are transported inside their river world and its elaborate cosmogony. But old ways are being forgotten and the indigenous people now face cultural genocide. In a world that continuously puts a price tag on nature and humanizes the corporations responsible for the cultural genocide that is taking place, a federation of women resolutely decides to fight back.",Asia Premiere,,Hot Docs International Documentary Festival 2024,"Hot Docs 2024 Trailer: KARUARA, PEOPLE OF THE RIVER","Ecology, Films By Women, Hybrids, De-Gendered",Quisca Productions,press kit,Karuara,AFICHE KARUARA MUYUNA 4.5 corrida.jpg,Press Kit Karuara.pdf,,,,2024
Mission Life,On Melting Snow,,Belgium,2024,French,73',Colour,Mojtaba Bahadori,"Mojtaba Bahadori is a filmmaker, photographer, and visual artist. His background in cinema and gemology informs his unique exploration of the natural world, reflecting his deep connection to both nature and the human experience.",Mojtaba Bahadori,Mojtaba Bahadori,Mojtaba Bahadori,Mojtaba Bahadori,Sophie Cauvin,"Our earth is constantly undergoing changes, with humans often accelerating and disrupting its natural progression. Each landscape reflects a memory of our planet, memories that have been cruelly divided by man-made political borders. For the past 33 years, Sophie Cauvin has been on a journey to engage with these transformed landscapes and reunite these fragmented memories through her art creations.",India Premiere,United Nations Climate Change Prize 2024,"Film Fest Tuscon 2024, United Nations Climate Change Conference 2024",,"Ecology, Documentary, Social Impact",,DSCF7307-2.jpg,On Melting Snow,Poster OMS En big.jpg,,,,,2024
Mission Life,The Falling Sky,A Queda Do Céu,"Brazil, Italy, France",2024,"Yanomamö, Portuguese",110',Colour,"Eryk Rocha, Gabriela Carneiro Da Cunha","Eryk Rocha is a filmmaker from Brazil. His films have played and won awards at festivals such as Cannes, Sundance, Venice, Locarno, and Rotterdam. Gabriela Carneiro da Cunha is a Brazilian filmmaker and researcher, whose work has been presented at Wiener Festwochen, Festival d'Automne and Centre Georges Pompidou in Paris. The Falling Sky is her debut feature.","Eryk Rocha, Gabriela Carneiro Da Cunha","Eryk Rocha, Gabriela Carneiro Da Cunha","Bernard Machado, Eryk Rocha",Renato Vallone,"Davi Kopenawa, Justino Yanomami, Givaldo Yanomami","Until the early 1970s, the indigenous Yanomami and Watoriki Amazonian tribes lived in relative isolation. However, during Brazil's military dictatorship, a highway was built across their territory, devastating the landscape and opening it up to resource extraction companies. Narrated by Yanomami shaman and leader Davi Kopenawa, this breathtaking documentary traces his indigenous amazonian community’s preparations for a time-worn funeral rite said to hold up the sky, a ceremony that also galvanises them in the battle to defend their homeland against illegal gold mining.",India Premiere,"Best International Feature Documentary, Guanajuato International Film Festival 2024","Cannes Film Festival 2024, Melbourne International Film Festival 2024",The Falling Sky - Teaser Trailer Internazionale,"Ecology, Films by Women, Documentary, Social Impact",Rediance Films,"Eryk Rocha Photo - Credits_ Paula Gaitán.jpeg
Gabriela Carneiro da Cunha Photo - Credits_eryk_rocha.jpg",The Falling Sky,QDC_Poster_Final_Inglês_page-0001.jpg,qdc_pressrelease-compactado.pdf,,,,2024
ICFT UNESCO Gandhi Medal,Through Rocks and Clouds,Raiz,"Peru, Chile",2024,"Quechua, Spanish",83',Colour,Franco García Becerra,"Franco García’s debut feature film, Southern Winds (2018), premiered at the Lima Film Festival (Peru), also was selected at Dominican Global Film Festival, Chicago Latino Film Festival, Cine de las Americas Film Festival, among others. Through Rocks And Clouds (2024), his second feature film, had its world premiere at the 74th Berlin Film Festival.","Diego Sarmiento, Jorge Constantino, Annemarie Gunkel, Franco García Becerra, Juan Francisco Gonzàlez","Annemarie Gunkel, Alicia Quispe",Johan Carrasco,"Franco García Becerra, Juan Francisco González","Alberth Merma, Nely Huayta, Richard Taipe, Rubén Huillca, José Merma","Feliciano, an 8-year-old Alpaca herder, feels euphoric: Peru has a chance to qualify for the World Cup. Meanwhile the pressure of a mining company puts Feliciano ́s village at risk and threatens his world and his dreams.",India Premiere,"Generation Kplus - Special Mention, Berlin International Film Festival 2024","Berlin International Film Festival 2024, Locarno International Film Festival 2024",film excerpts 1 - sub english.mp4,"Films by women, Social Impact",Luxbox,Franco Garcia photo-2.jpg,Through Rocks and Clouds,120x160 THROUGH ROCKS AND CLOUDS 28-02 award BD.pdf,PRESSKIT_ThroughRocks&Clouds.pdf,,,Sound: Amador del Solar,2024
ICFT UNESCO Gandhi Medal,The Rebels,Myatezhniki | Мятежники,Russian Federation,2024,Russian,120',Colour,Vladimir Alenikov,"Vladimir is a theatre and film director, writer, and poet. His musical The Drayman and the King (1990) was widely praised at the Toronto Film Festival and the Los Angeles Film Festival, winning him global recognition. He is the Head of the Moscow Musical and Drama Theater “ÀNTE”. His acclaimed filmography includes: The Gun (from 6 to 7:30 p.m.) (2003), Ulybka Boga, ili Chisto odesskaya istoriya (2008) and Voyna Printsessy (2013).","Vladimir Alenikov, Konstantin Serebriakov, Elena Tkachuk",Vladimir Alenikov,Lubov Kniazeva,Dmitriy Yushin,"Vasilisa Korostyshevskaya, Olga Volkova, Yevgeniy Marchelli, Vitaliy Daushev, Olga Spirkina, Anna Roskoshnaya, Oksana Korostyshevskaya, Miroslava Smirnov, Leonid Chornykh, Artiom Kostyrev, Yekaterina Yartseva","An artful businessman intends to build a large commercial complex. But bad luck, there is no free space for this in the city center. The businessman incites selfish city officials to demolish the building of a boarding school for disabled children, where the heroine of the film, the silent girl Nastya, ends up. But the children categorically disagree with this and defend their home.",India Premiere,,"Shanghai International Film Festival 2024, Moscow International Film Festival 2024",,Social Impact,Eastwood Agency,REBELS _ VLADIMIR ALENIKOV _ DIRECTOR'S PORTRAIT.JPG,Rebels,REBELS _ POSTER.jpg,,,,Sound Editor: Sergey Siniavskiy; Composer: Varvara Rogovich; Art Director: Ilya Yevdokimov,2024
ICFT UNESCO Gandhi Medal,Clarice's Dream,O Sonho De Clarice,Brazil,2024,Portuguese,83',Colour,"Guto Bicalho, Fernando Gutierrez","Fernando Gutiérrez holds a Ph.D. in Arts from UnB, with a focus on voice, performance, animation, and independent scene research. As a filmmaker, he has several short films to his credit, including O Mascate and José. 
Guto Bicalho is a Director, and Storyboard Artist. He has directed the short films Sangro and Fuga Animada. He served as a storyboard supervisor for the feature film Perlimps as well as for series on Cartoon Network, Nickelodeon, Gloob, Disney, and others.",Fernando Gutierrez,"Guto Bicalho, Cesar Lignelli, Fernando Gutiérrez, Oko",,Guto Bicalho,"Dandara Luana, 
Paula Passos, 
Clarice Gutiérrez","The story of an extremely creative girl who goes through the process of overcoming the loss of her mother. It is a film that speaks of friendship, companionship, and the many beauties that surround us every day, often unnoticed.",India Premiere,"Best Art Direction; Best Sound Editing; Best Sountrack, 56º Festival de Brasília do Cinema Brasileiro 2023","56º Festival de Brasília do Cinema Brasileiro 2023, VBIFF - Vancouver Black Independent Film Festival 2024",TRAILER O SONHO DE CLARICE,Social Impact,,Headshot 860966abf1-headshot.jpg,Clarice's Dream,Poster fd2398d56b-poster.jpg,,https://www.instagram.com/osonhodeclarice/,,,2024
ICFT UNESCO Gandhi Medal,Kabuliwala,,India,1956,Bengali,108',Colour,Tapan Sinha,"Tapan Sinha is one of India's most prominent filmmakers, and one of the forerunners of the 'Parallel Cinema' movement. In his six-decade long career, he made films in Bengali, Hindi and Oriya languages, straddling genres from social realism, family drama, labor rights, to children's fantasy films. His most noted films include Kabuliwala (1957), Louha-Kapat, Sagina Mahato (1970), Apanjan (1968), Kshudhita Pashan and children's film Safed Haathi (1978) and Aaj Ka Robinhood (1987). Sinha is known for forming a legendary quartet with contemporary filmmakers such as Satyajit Ray, Ritwik Ghatak and Mrinal Sen.",,"Premendra Mitra,Tapan Sinha, Rabindranath Tagore (author, Kabuliwala)",Anil Banerjee,Subodh Ray,"Chhabi Biswas, Oindrila Tagore, Radhamohan Bhattacharya","An Afghan fruit seller befriends a small Bengali girl in Calcutta because she reminds him of his daughter. He gets a letter notifying him of his daughter’s illness and decides to return, but kills a man in a dispute on the eve of his journey and spends the next ten years in jail. Adapted from a story by Rabindranath Tagore.",,"Silver Bear, Berlin Intenational Film Festival 1957 | 
President's Gold Medal, National Film Awards 1957","Berlin International Film Festival, 1957",Kabuliwala (কাবুলিওয়ালা ) National Film Award Movie | promo-3,Social Impact,,tapan.jpeg,Screenshot 2024-11-04 at 5.45.16 PM.png,,,,,,2024
ICFT UNESCO Gandhi Medal,Gypsy,The Nomadic Tribe,India,2024,Marathi,120',Colour,Shashi Chandrakant Khandare,"Shashi Khandare, a Pune-based
writer and director, started as
a clapper boy, and later worked as an
associate director. His award-winning
short films Surma and
Gypsy have received accolades at many
international film festivals,
including Cannes.","Bolpat Nirmitee,
Shraddha Shashi Khandare",Shashi Chandrakant Khandare,Pravin Jalindar Sonavane,Akshay Shinde,Kabir,"Jotya, a boy born in an itinerant nomadic family, quests for a better life. Forced to beg for stale and rotten food every day, little Jotya has to make do with the smell of fresh food, something he has grown to cherish. While his pregnant mother struggles to make ends meet, Jotya becomes obsessed with a particular smell, a smell that will forever change his life.",,,,,Social Impact,,2. Gypsy_Director,https://drive.google.com/drive/folders/1zFM42FTkqB-tLUO8EL6udgmJA4_oHOwP?usp=drive_link,6. Gypsy_Poster,,https://www.instagram.com/shashikhandare,https://x.com/ShashiC53392639,,2024
BFI@IFFI,In Camera,In Camera,United Kingdom,2023,English,96',Colour,Naqqash Khalid,"Naqqash Khalid is a writer, director and producer known for In Camera (2023).","Juliette Larthe, Mary Burke",Naqqash Khalid,Tasha Back,Ricardo Saraiva,"Nabhaan Rizwan, Amir El-Masry & Rory
Fleck Byrne","In Camera follows Aden, a young actor caught in a cycle of nightmarish auditions, facing rejection after rejection. Formally playful and fiercely charged, Khalid's debut about a struggling British Asian actor confronts film industry prejudice and social hypocricsy head-on.",Asia Premiere,"International Federation of Film Critics (FIPRESCI) Award; Best Film, Thessaloniki International Film Festival 2024",British Independent Film Awards 2024,In Camera - Official Trailer,"Meta-Cinema, Global Politics, Histocial, Social Impact",Together Films,Naqqash+Khalid+by+Lucia+O’Connor-McCarthy.jpeg,In Camera,,IN CAMERA Sales Deck.pdf,,,,2024
BFI@IFFI,Layla,,United Kingdom,2024,English,100',Colour,Amrou Al-Kadhi,"Amrou Al-Kadhi is a British-Iraqi writer, drag performer, and filmmaker whose work primarily focuses on queer identity, cultural representation and racial politics. Al-Kadhi made a cameo appearance in the 2021 Sony's Spider-Man Universe (SSU) film Venom: Let There Be Carnage as a temporary host of the title character. Layla is is feature debut.",Savannah James-Bayly,Amrou Al-Kadhi,Craig Dean Devine,Fiona Brands,"Bilal Hasna, Louis Greatorex, Safiyya Ingar, Terique Jarrett and Sarah Agha","Layla is a struggling Arab drag queen who hides their insecurities behind a radical facade. Performing at a corporate Pride party, they catch the eye of Max, a successful white gay man whose attention sweeps Layla off their feet. The two start an intoxicating romance, but as Layla starts to alter who they are in order to keep Max’s affections, they both have to face uncomfortable truths.",India Premiere,,"Sundance Film Festival 2024, BFI Flare 2024",Layla | Official Trailer | Film4,"LGBTQIA+. Global Politics
Comedy,",Independent Entertainment,Layla,Layla,,,https://x.com/Glamrou,,,2024
BFI@IFFI,Bring Them Down,,"Ireland, United Kingdom",2024,"English, Irish",106',Colour,Christopher Andrews,"Christopher Andrews is a UK-based writer-director. He’s directed the short films Fire (2015) and Stalker (2018), and has written scripts for the upcoming films Cavendish and an adaptation of the Booker-winner Frankenstein in Baghdad.","Ivana MacKinnon, Jacob Swan Hyam, Ruth Treacy, Julianne Forde, Jean-Yves Roubin, Cassandre Warnauts","Christopher Andrews, Jonathan Hourigan",Nick Cooke,George Cragg,"Christopher Abbott, Barry Keoghan, Colm Meaney, Nora-Jane Noone, Paul Ready, Aaron Heffernan","Michael, the last son of a shepherding family, lives with his ailing father, Ray. When a conflict with rival farmer Gary and his son Jack escalates, a devastating chain of events leaves both families permanently altered.",Asia Premiere,,"Toronto International Film Festival 2024, BFI London Film Festival 2024",,"Thriller, De/Gendered",Charades,Christopher Andrews - Headshot.jpg,Bring Them Down,Bring-Them-Down poster.jpg,BRING THEM DOWN CREDITS .pdf,,,,2024
BFI@IFFI,The Draughtsman’s Contract,,United Kingdom,1982,English,107',Colour,Peter Greenaway,"Peter Greenaway is a British film director, editor, screenwriter and a visual artist. He has produced a wealth of short and feature-length films, but also paintings, novels and other books. A trained painter, he has held several one-man shows and curated exhibitions at museums world-wide. His films are characterised by a an overpowering visual aspect and his recurring interest in Renaissance, Baroque and Flemish art. Most notable among them: The Cook, the Thief, His Wife & Her Lover (1989), A Zed & Two Noughts (1985), The Draughtsman's Contract (1982), and Rembrandt's J'Accuse (2008),",David Payne,Peter Greenaway,Curtis Clark,John Wilson,"Anthony Higgins, Janet Suzman, Anne Louise Lambert","Set in rural Wiltshire in 1694, Greenaway’s breakthrough feature has an arrogant young artist insisting on payment in sexual favours when a woman commissions him to paint a series of pictures of her family’s house and grounds. But things are not as they may seem… Acerbic dialogue, flamboyant costumes, crisp compositions and, above all, Michael Nyman’s Purcell-based score make for intriguingly intelligent entertainment.",,,"Venice Film Festival 1982, Chicago International Film Festival 1982",New trailer for The Draughtsman's Contract - in cinemas from 11 November 2022 | BFI,"Historical, Thriller, Comedy",BFI,The Draughtsman’s Contract,The Draughtsman’s Contract,,,https://x.com/Greenaway_Peter,https://www.facebook.com/PeterGreenawayPage/,,2024
BFI@IFFI,Sky Peals,,United Kingdom,2023,English,91',Colour,Moin Hussain,"Moin is a London based writer and director. His short films have screened in competition at festivals around the world, including Cannes Semaine De La Critique, Sitges, BFI London Film Festival and Edinburgh International Film Festival. He has been named as one of Screen International’s ‘Stars of Tomorrow’. Sky Peals is his debut feature.",Michelle Stein,Moin Hussain,Nick Cooke,Nse Asquo,"Faraz Ayub, Natalie Gavin, Claire Rushbrook, Simon Nagra, Steve Oram, Jeff Mirza, Bill Fellows","Adam works nightshifts at a motorway service station and lives a small and lonely life. Upon hearing that his estranged father has died, he finds himself in search of answers. Piecing together a complicated image of a man he never knew, Adam starts to become convinced he descends from an alien race.",Asia Premiere,,"Venice Film Festival 2023, London Film Festival 2023",Sky Peals | Official Trailer | Film4,Technology,Bank Side Films,Sky Peals,Sky Peals,,,,,,2024
Restored Classics,Bobo,The Bogeyman,Armenia,1991,Armenian,67',Colour,"Narine Mkrtchyan, Arsen Azatian","Narine Mkrtchyan was born in 1960 in Yerevan, USSR [now Armenia]. She is a director and writer known for Bobo (1991), Radio Yerevan (1992), and Anarak vordu veradardz (2008). Arsen Azatian is an Armenian filmmaker, best known for films like Radio Yerevan (1993), The Return of The Prodigal Son (2008), and The Glass Trinket (2012).","Narine Mkrtchyan, Arsen Azatyan","Narine Mkrtchyan, Arsen Azatyan",Albert Yavuryan,"Narine Mkrtchyan, Arsen Azatyan","Sergey Parajanov, Albert Yavuryan, Nariné Mkrtchyan, Arsen Azatyan, Alena Varjapetyan","Bobo is dedicated to the renowned Armenian filmmaker Sergei Parajanov, to the unfolding memory of a man who was variously referred to as a genius, a mime, a tradesman, and a saint. Chronicling Parajanov's final days, the film altogether breaks away from film genres and logical plot points, and instead becomes a psychoanalysis of the nether-world essence of the great master, a search for other dimensions about which we dare not even sometimes speculate.",World Premiere,,Berlin International Film Festival 1992,,Hybrids,Aysor Plus Films,"Arsen Azatyan.jpg
NARINE MKRTCHYAN.jpg",BOBO,POSTER Small.pdf,BOBO (Excerpt).mov,,,,2024
Restored Classics,Four Nights of a Dreamer,Quatre Nuits D’un Rêveur,France,1971,French,83',Colour,Robert Bresson,"Robert Bresson is one of the most revered and pivotal of French filmmakers. His films are infused with spiritual themes, often attempting to examine issues of redemption and salvation, and how the individual’s place in the broader society may affect the possibility of achieving either state. While his films are undeniably serious and frequently challenging, Bresson’s oeuvre is undeniably one of the most sublime in cinema history.",Gian Vittorio Baldi,Robert Bresson,Pierre Lhomme,Raymond Lamy,"Isabelle Weingarten, Guillaume des Forêts, Jean-Maurice Monnoyer, Lidia Biondi","Perhaps Robert Bresson’s most underrated film, Four Nights of a Dreamer finds the ascetic master again adapting Fyodor Dostoevsky, here transposing the short story “White Nights” to contemporary Paris. Four Nights of a Dreamer captures a series of meetings across consecutive nights between Jacques and Marthe. Surrounded by the still-smoldering remains of May ’68, the two open their hearts to each other, conjuring the majesty and mystery of human connection, at once obscure and clarifying, direct and ambiguous.",India Premiere,,"Berlin International Film Festival 1971, Cannes Film Festival 2024",https://www.youtube.com/watch?v=Drppr8bmjuY,Festival Hits,mk2 Films,bresson003.jpg,Four Nights Of A Dreamer,QUATRE NUITS-AFF-CANNES US.jpg,FOUR NIGHTS OF A DREAMER_Press Notes_Cannes Classics.pdf,,,,2024
