From The Festivals,The Second Act,Le Deuxième Acte,France,2024,French,85',Colour,Quentin Dupieux,"Quentin Dupieux is a filmmaker and musician from France. Dupieux is considered a true auteur, being the writer, editor and director of photography for all his films. He has even (co-)composed the music for half of his films, many of which have had their world premieres at festivals such as Cannes, Venice and Sundance. Dupieux’ films are unique and skew away from narrative conventions, with a penchant for the absurd. His Incredible But True (2022) premiered at Berlinale, Smoking Causes Coughing (2022) in Cannes, while Daaaaaali! (2023) was selected for IFFR 2024.",Hugo Sélignac,Quentin Dupieux,Quentin Dupieux,Quentin Dupieux,"Léa Seydoux, Vincent Lindon, Louis Garrel, Raphaël Quenard","Florence wants to introduce David, the man she’s madly in love with, to her father Guillaume. But David isn’t attracted to Florence and wants to throw her into the arms of his friend Willy. The four of them meet in a restaurant in the middle of nowhere, where they suddenly begin to act out a scene from a third-rate movie production. Quentin Dupieux’s latest film is self-referential cinema at its best, in which, much like his other films, the absurd becomes a genre unto itself.",India Premiere,,Cannes Film Festival 2024,The Second Act / Le Deuxième acte (2024) - Trailer (English Subs) - YouTube,"Comedy, Meta-Cinema, Festival Hits",Kinology,QuentinDupieuxHD PhotoCredit Audoin Desforges (1).jpg,The Second Act,LDA_MAQ120_CREDITS_HD.pdfk,,,,,2024
Rising Stars,"Crickets, It’s Your Turn",,"France, Kazakhstan",2024,Russian,105',Colour,Olga Korotko,"Olga studied film at the New
York Film Academy, took part in
the Berlinale Talents Campus,
and subsequently obtained
an MFA in film directing from the
Zhurgenov National Academy of
Fine Arts in Kazakhstan. Her first
feature film, Bad Bad Winter,
had its world premiere at Cannes (2018).","Etienne de Ricaud, Olga Korotko",Olga Korotko,Aigul Nurbulatova,"Ricardo Saraiva, Yedilkhan Amandyk","Inzhu Abeu, Ayan Batyrbek, Arnur Kusaingazin, Nurlybek Maulezaripov, Boris Yugay, Alexandr Khvan","25-year-old Merey lives a quiet but happy life in Almaty. By chance, she meets the charming Nurlan, who invites her to a birthday party in the mountains. She expects a simple celebration with new friends, but what ensues is an intense and tumultuous night that quickly spirals into a dark game of cat and mouse.",India Premiere,,Locarno International Film Festival 2024,,"Films By Women, Thriller, De/Gendered",Cercamon,Director.JPG,"Crickets, It's Your Turn",press kit,Crickets PK.pdf,,,,2024
Rising Stars,Cu Li Never Cries,Cu Li Không Bao Giờ Khóc,"Vietnam, Singapore, France, Philippines, Norway",2024,Vietnamese,92',Black & White,Phạm Ngọc Lân,"Born and raised in Hanoi, Lân graduated with a degree in urban planning and taught himself filmmaking at 27. His short films include The Story of
Ones (2012, Visions du Réel); Another City (2016, Berlinale); Blessed Land (2019, Berlinale) and The Unseen River (2021, Locarno, Sundance). Cu Li
Never Cries is his first featurelength film.","Nghiêm Quỳnh Trang, Trần Thị Bích Ngọc",Phạm Ngọc Lân & Nghiêm Quỳnh Trang,"Vũ Hoàng Triều, Nguyễn Vinh Phúc, Nguyễn Phan Linh Đan",Julie Béziau,"Minh Chau, Ha Phuong, Xuan An, Hoang Ha","A woman tries to cling onto dimming links to her past after inheriting a pygmy slow loris from her long-estranged husband. Meanwhile, her niece prepares for marriage as the young couple ponders their gloomy future together. The present and the complex echoes of Vietnamese history are entwined before a contemplative and poetic perspective.",India Premiere,"GWFF Best First Feature Award (Federal Government Commissioner for Culture and the Media), Berlinale 2024 I Best Picture Prize (International), Jeonju International Film Festival 2024","Berlin International Film Festival 2024, Jeonju International Film Festival 2024",Cu Li Never Cries - Trailer,"Historical, De/Gendered, Global Politics",Square Eyes,Director - PhamNgocLan.jpg,Cu Li Never Cries,Poster - Cu Li Never Cries.jpg,CuLiNeverCries_EPK.pdf,,,,2024
Rising Stars,Else,,"France, Belgium",2024,French,100',Colour,Thibault Emin,"Thibault Emin is a French director and screenwriter. He studied film at Paris 8 University, and then at La Fémis. He’s directed several short films, including the short film Else (2007), which formed the basis for his feature debut. Else (24) is his latest film.","Damien Lagogué,
Benoit Roland","Thibault Emin, Alice Butaud, Emma Sandona",Léo Lefèvre,Ariane Boukerche,"Matthieu Sampeur, Edith Proust, Lika Minamoto","Anx has just met Cass when a mysterious virus breaks out: everywhere, people’s bodies are merging with objects. Stuck in their apartment, the couple must now face this dreadful threat. A mesmerising body-horror romance, Else profoundly articulates a unique vision of the end of everything, and how it may, in fact, just be the start of something new.",Asia Premiere,,Toronto International Film Festival 2024,,"Avant-Garde, Hybrids, Horror, Technology",WTFILMS,IMG_20210117_000332.jpeg,Else,ELSE_70x100_HD.pdf,,,,,2024
Rising Stars,Hunters on a White Field,Jakt På Ett Vitt Fält,Sweden,2024,Swedish,97',Colour,Sarah Gyllenstierna,"Sarah Gyllenstierna was born in Stockholm, Sweden. She is a producer and director, known for Juice (1992) and He Got Game (1998).","Maria L. Guerpillon, Charlotte Most",Sarah Gyllenstierna,Josua Enblom,Philip Bergström,"Ardalan Esmaili, Magnus Krepper, Jens Hultén","Three men go on an extended weekend hunting trip deep in the Swedish forest. Gregor and Henrik are old friends and more experienced hunters, while Alex is a novice (and Gregor’s protégé at work). Their trip is initially greeted by success on the hunt, sharpening their instincts in the field and drumming up a rivalry between the three men. But one day all the animals vanish without a trace, leaving the forest eerily quiet and the men with nothing to hunt. Spurred on by overactive male bravado, the misguided macho inclination to compare themselves to men of the past, and a bit of natural hallucinogens, the trio find a way for the hunt to continue, even in a forest without animals.",India Premiere,,Tribeca Film Festival 2024,TRAILER - Hunters on a White Field (2024),"Films By Women, Thriller, De/Gendered",LevelK,SarahGyllenstierna_01_©OlaKjelbye.jpg,Hunters On A White Field,HuntersOnAWhiteField_UK_POSTER_70x100_RGB.jpg,,,,,2024
Rising Stars,Hunting Daze,Jour De Chasse,Canada,2023,Quebec French,79',Colour,Annick Blanc,"Driven by her love for visually intriguing and innovative storytelling, Annick Blanc co- founded Midi La Nuit with Maria Gracia Turgeon. As a director, Hunting Daze (2023) is her first feature film. Her filmography of shorts includes: The Colour of Your Lips (2019), Turn Off Before Living (2015) and Nowhere Elsewhere (2010) which have garnered prizes at many a festivals. As a producer she has helped create more than 15 projects, which have been screened at prestigious film festivals. Amongst them Who Do I Belong To (2024, Berlinale Competition), Hunting Daze (2023, SXSW), Brotherhood (2019 - Oscar nominee, Best Canadian Short TIFF), and Fauve (2018 - Oscar nominee, Sundance Jury Prize).","Maria Gracia Turgeon, Annick Blanc",Annick Blanc,Vincent Gonneville,Amélie Labrèche,"Nahéma Ricci, Bruno Marcil, Frédéric Millaire-Zouvi, Marc Beaupré, Alexandre Landry, Maxime Genois, Noubi Ndiaye","Nina, a headstrong young woman, joins a group of hunters at a remote cabin. In this male micro-society, she finally feels a newfound sense of belonging. But the delicate balance of their pack is threatened with the arrival of a mysterious stranger.",India Premiere,,SXSW 2024,Trailer,"Films by Women, Thriller, De/Gendered",ArtHood Entertainment,Headshots + Bios,Stills,Poster,EPK,,,,2024
Rising Stars,Lilies Not for Me,,"United States, United Kingdom, France, South Africa",2024,English,99',Colour,Will Seefried,"Will Seefried is an award-winning writer, director & filmmaker. He is known for Lilies Not for Me (2024), Homesick (2022) and Sink Sank Sunk (2018).","Will Seefried, Robert Aramayo",Will Seefried,Cory Fraiman-Lott,Julia Bloch,"Fionn O’Shea, Robert Aramayo, Louis Hoffman, Erin Kellyman, Jodi Balfour","In 1920s England, a gay novelist and his psychiatric nurse form an unlikely friendship over a series of doctor-prescribed ‘dates’. Through their conversations, he tells her the story of his relationship with an old friend which spiraled out of control when they turned to a risky procedure to cure themselves of their forbidden feelings for one another.",Asia Premiere,,Edinburgh International Film Festival 2024,Press Clip 2.mp4,"LGBTQIA+, Social Impact",Memento International,Will Seefried - (c) Jenni Elizabeth.png,Lilies Not For Me,not available,PRESS KIT Lilies Not For Me .docx.pdf,,,,2024
Rising Stars,Linda,,"Argentina, Spain",2024,Spanish,100',Colour,Mariana Wainstein,Mariana Wainstein is a writer and director. She’s directed short films including Las Hormigas (2017) and Error 404 (2016). Linda (2024) is her feature debut.,"Pablo E. Bossi, Cabe Bossi, Pol Bossi.","Mariana Wainstein, Diego Bliffeld, Luciano Cocciardi, Horacio Convertini, Juan Cordoni, Sabrina Campos, Nancy Gai",Marcos Hastrup,Miguel Colombo,"Eugenia China Suárez, Rafael Spregelburd, Julieta Cardinali, Minerva Casero","Self-assured, mysterious, and captivating Linda agrees to work at an affluent home in Buenos Aires, covering for her cousin who’s recovering from an accident. Her charm sparks strong sexual attraction among all four members of the family, exposing how fragile their externally happy veneer really is. Turning away from grand gestures, the narrative drills on the mundane to explore Linda's shattering of the male egos involved as well as the power dynamic between the female employer and the “help"".",Asia Premiere,,"Toronto International Film Festival 2024,
Zurich International Film Festival 2024",LINDA Trailer | TIFF 2024,"Films by Women, De/Gendered",Meikincine Entertainment,Mariana Wainstein _ Linda (Horizontal).jpg,Linda,Linda - Poster.jpg,LINDA - BRIEF.pdf,,,,2024
Rising Stars,Locust,Chong,"Taiwan, United States, France, Qatar",2024,"Mandarin, Hokkein, Hakka",133',Colour,KEFF,"KEFF is a Taiwanese-American multidisciplinary artist based in New York and Taipei. He recently completed the NYU Graduate Film program on scholarship. His first short film, Secret Lives of Asians at Night, was supported by the Spike Lee Film Fellowship, and awarded the Jury Prize for Best Asian-American Film by the Director's Guild of America. His second short film and NYU thesis, Taipei Suicide Story, had its world premiere at the Cannes Film Festival (Cinéfondation), and won the Grand Jury Prize (Narrative Feature) at the Slamdance Film Festival. He is also an open-format DJ and producer that has performed with countless international artists at parties such as Brownies & Lemonade (LA), SHOWER @ Soap (Korea), SUBBEAT @ Cakeshop (Korea) and BangOn! (NYC).","Anita Gou, Siuloku O","KEFF, Junu Wu","Nadim Carlsen, DFF","KEFF, Siuloku O., Jenson Tay Yi","Liu Wei-chen, Rimong Ihwar, Devin Pan, Yu An Shun, Wu Yi-Jung","As the 2019 Hong Kong protests erupt across the strait, Zhong-Han, a silent twenty-nothing in Taiwan, leads a double life – working at a family restaurant by day, and running with a group of local gangsters by night. But when the ownership of the restaurant changes hands, it sets off an unexpected chain reaction that forces Zhong-Han to witness and confront the corrupt power games of his country.",India Premiere,,"Cannes Film Festival 2024, Warsaw International Film Festival 2024",TRAILER - Locust (2024),"Thriller, Global Politics",MK2,LOCUST - KEFF Headshot.jpg,Locust,missing,locust-press-notes.docx.pdf,,,,2024
Rising Stars,Manas,,"Brazil, Portugal",2024,Spanish,101',Colour,Mariana Brennand,"Marianna Brennand, after graduating with a degree in film at UCSB, made Francisco Brennanda (2012), a documentary about a Brazilian artist globally recognized for his ceramic work, who was also her great-uncle Francisco. The film won both Best Brazilian Documentary and Best Brazilian Film at the São Paulo Film Festival. Manas marks Brennand’s feature film directorial debut and is the result of a ten-year research into the complex and delicate subject of the sexual abuse and exploitation of children and teenagers on Marajó Island, in the Amazon rainforest.","Carolina Benevides, Marianna Brennand","Felipe Sholl, Marcelo Grabowsky, Marianna Brennand, Antonia Pellegrino,
Camila Agustini, Carolina Benevides",Pierre De Kerchove,Isabela Monteiro de Castro,"Jamilli Correa, Fátima Macedo, Rômulo Braga, Dira Paes, Emilu Pantoja, Samira Eloá, Gabriel Rodrigues, Enzo Maia","Island of Marajó, Amazon rainforest. Marcielle,13, lives by the riverbanks with her father, mother, and three siblings. Prompted by her mother's words, she idolizes her older sister who supposedly escaped her reality by ""finding a good man"" on the barges that ply the region. As Tielle matures, her idealized visions shatter, leaving her trapped between two abusive environments. Increasingly worried about her younger sister and the bleak future they face, she decides to confront the oppressive system that controls her family and the women in their community.",Asia Premiere,"Giornate degli Autori Director's Award, Venice International Film Festival 2024",Venice International Film Festival 2024,MANAS | Teaser Oficial,"Films By Women, Global Politics, De/Gendered, Social Impact",Bendita Films Sales,Marianna Brennand director's portrait.jpg,Stills,Poster_MANAS.jpgk,Manas_Pressbook_ENG.pdf,,,,2024
Rising Stars,Memories of a Burning Body,Memorias De Un Cuerpo Que Arde,"Costa Rica, Spain",2024,Spanish,90',Colour,Antonella Sudassassi Furniss,"Her first film, The Awakening of the Ants (2019), premiered at the Berlinale Forum, in 2019 and was selected for more than 65 international festivals, representing the country at the Academy Awards and becoming the first Costa Rican film to be recognized by the Platino Awards and the first Central American movie to receive a Goya Award nomination. Memories of a Burning Body is her second feature film.",Antonella Sudasassi Furniss,Antonella Sudassassi Furniss,Andrés Campos,Bernat Aragonés,"Sol Carball, Paulina Bernini, Juliana Filloy, Liliana Biamonte","Growing up in a repressive era when sexuality was a taboo subject, 68-year-old Ana, 69-year-old Patricia and 71-year-old Mayela developed their understanding of what it means to be a woman based on unspoken rules and implicit expectations. Now they dare to talk about it openly. The memories, secrets and longings of the three are interwoven in a poetic way: while the women tell their stories off-screen, they are lived out in the body of another woman of their generation.",India Premiere,"Panorama Audience Award, Berlin International Film Festival 2024","Berlin International Film Festival 2024, Istanbul Film Festival 2024, Rio de Janeiro International Film Festival 2024",MEMORIES OF A BURNING BODY - International trailer,"Films By Women, De/Gendered, Social Impact",Bendita Film Sales,memories.jpeg,press kit,press kit,Memorias_Pressbook_updated.pdf,,,,2024
Docu-Montage,Afternoons of Solitude,Tardes De Soledad,"Spain, France, Portugal",2024,Spanish,123',Colour,Albert Serra,"Catalan artist and filmmaker Albert Serra holds a degree in Spanish Philology and Literary Theory. His films –Birdsong (2008), Story of my Death (2013), Liberté (2019), Pacifiction (2022)– have premiered and won awards at festivals such as Cannes, Locarno, TIFF and IFFR.","Pedro Palacios, Ricard Sales, Montse Triola, Luis Ferrón, Pierre-Olivier Bardet, Albert Serra, Joaquim Sapinho",Albert Serra,Artur Tort Pujol,"Albert Serra, Artur Tort Pujol",Andrez Roca Rey,"Filmmaker Albert Serra trains a patient and poetic lens on the dazzling pomp and devastating brutality of bullfighting in his new documentary portrait of the charismatic Peruvian-born star torero Andrés Roca Rey. Intensely in-the-moment, Afternoons of Solitude expertly balances the visceral thrill of the battle inside the ring, pitting animal instinct against human technique, with a meditative filmmaking style that allows the viewer to appreciate the emotional and physical toll the violence takes on both man and beast.",India Premiere,"Golden Shell for Best Film, San Sebastian Film Festival 2024","San Sebastián International Film Festival 2024, New York Film Festival 2024, Tokyo International Film Festival 2024",Tardes de soledad' - Tráiler,"Documentary, Festival Hits",Films Boutique,Albert Serra_CANNES©Óscar Fernández Orengo.jpg,Afternoons of Solitude,unavailable,AFTERNOONS OF SOLITUDE - film info.pdf,https://www.facebook.com/p/Albert-Serra-100044731155548/,,,2024
Docu-Montage,Black Box Diaries,,"Japan, United States, United Kingdom",2024,"Japanese, English",103',Colour,Shiori Itō,"Shiori Ito is a journalist, writer, and documentary filmmaker with a focus on gender-based human rights issues. In 2020, Time magazine listed her as one of the 100 Most Influential People in the world. Black Box Diaries is her feature documentary.","Eric Nyari, Hanna Aqvilin, Shiori Itō",Shiori Itō,"Yuta Okamura, Hanna Aqvilin, Shiori Itō, Yuichiro Otsuka, Keke Shiratama",Ema Ryan Yamazaki,Shiori Itō,"Journalist Shiori Itō turns the camera on herself in a breathtakingly courageous investigation of her own sexual assault, which resulted in a landmark case for the Me Too movement in Japan. From courtrooms to video diary entries, the film follows Itō’s 2017 court battle in real time, made all the more gripping by its palpable mix of journalistic acumen and harrowing trauma. Along the journey to bring Itō’s high-powered attacker to justice, Black Box Diaries also becomes an indictment of the legal system and social customs that actively thwart survivors of abuse.",India Premiere,"Human Rights Award, CPH:DOX 2024","Sundance Film Festival 2024, SXSW Film Festival 2024, CPH:DOX 2024, BFI London Film Festival 2024",‘Black Box Diaries’ – Trailer (MTV Documentary Films),"Documentary, Social Impact, De/Gendered, Films By Women",Dogwoof,By Sono Aida _MG_1356_r (1).jpg,Black Box Diaries,BlackBoxDiaries_1Sheet_Sales.jpg,,https://www.facebook.com/shiori0515,,,2024
Docu-Montage,Cinéma Laika,,"France, Finland",2024,"French, English, Finnish",81',Colour,Veljko Vidak,"Veljko Vidak is a Croatian filmmaker and artist. He graduated from the Academy of Fine Arts of Zagreb, and was later awarded a grant that enabled him to study at the Cité Internationale Des Arts in Paris. Cinéma Laika is his first documentary feature.","Veljko Vidak, Emmanuelle Felce","Emmanuelle Felce, Veljko Vidak",Veljko Vidak,"Veljko Vidak, Emmanuelle Felce","Aki Kaurismäki, Jim Jarmusch, Simon Al-Bazoon, Nuppu Koivu, Maustetytöt, Veljko Vidak","In a small picturesque village in Finland, Aki Kaurismäki and his friend, the poet and writer Mika Lätti, are constructing their own cinema theater within an old foundry. The cinema will be called Kino Laika – named after Kaurismäki’s dogs – and to help them, they have the colourful inhabitants of Karkkila, who wear leather jackets and race around in Cadillacs to the sounds of rock n’ roll. ‘Cinema Laika’ is a warm mix of deadpan Finnish humour and French elegance, deriving clear inspiration from Kaurismäki’s own signature style.",India Premiere,,"CPH:DOX 2024, Jeonju International Film Festival 2024",CINÉMA LAIKA trailer I PÖFF 2023,"Documentary, Meta-Cinema",The Match Factory,Portrait_Veljko_Vidak_by_Sami_Sorasalmi.jpg,Cinema Laika,Cinema Laika Poster PRINT A1 59x84 copyright 43eParalleleProductions.jpg,,https://www.facebook.com/veljko.vidak,,,2024
Docu-Montage,Dahomey,,"France, Senegal, Benin",2024,"French, Fon, English",67',Colour,Mati Diop,"Mati Diop is a French filmmaker and actress working in both France and Senegal. Her formally adventurous films explore exile, identity, memory and loss using fiction and documentary tools. Her first feature Atlantics (2019) was awarded the Grand Prix at the Cannes Film Festival.","Eve Robin, Judith Lou Lévy, Mati Diop",Mati Diop,Josephine Drouin Viallard,Gabriel Gonzalez,"Gildas Adannou, Habib Ahandessi, Joséa Guedje, Imelda Batamoussi","The African kingdom of Dahomey saw hundreds of its splendid royal artifacts plundered by French colonial troops in its waning days. Now, 26 of these treasures are set to return to their homeland. Filmmaker Mati Diop takes a singular approach to contemporary questions around belonging in our postcolonial world, transforming this rich subject matter into a multifaceted examination of ownership and exhibition, and employing multiple points of view, including—most strikingly—those of the artifacts themselves as they sail in darkness over the ocean to their original home.",India Premiere,"Golden Bear, Berlin International Film Festival 2024","Berlin International Film Festival 2024, Toronto International Film Festival 2024, San Sebastián International Film Festival 2024",DAHOMEY | Official Trailer | Coming Soon,"Documentary, Global Politics, Films By Women, Festival Hits, Historical",MUBI,Mati-Diop-Photo©Henry-Roy.jpg,Dahomey,DAHOMEY_ONESHEET_EN-Global.png,,https://www.facebook.com/mati.diop.3,,,2024
Docu-Montage,Gaucho Gaucho,,"United States, Argentina",2024,Spanish,84',Colour,"Michael Dweck, Gregory Kershaw",Michael Dweck is a filmmaker and visual artist whose work explores ongoing struggles between identity and adaptation within endangered societal enclaves. Gregory Kershaw is an award-winning filmmaker whose work explores the complexity of humans confronting an ever-changing world. Their film The Truffle Hunters (2020) was selected for over 45 international festivals and was also shortlisted for the Oscars (Best Documentary).,"Michael Dweck, Gregory Kershaw, Matthew Perniciaro, Christos V. Konstantakopoulos, Cameron O'Reilly",,"Michael Dweck, Gregory Kershaw",Gabriel Rhodes,,"In the endless plains and desolate mountains of Argentina live the so-called gauchos. Cowboys and cowgirls dressed in beautiful uniforms and with an almost spiritual connection to their horses and the land they ride on. They drink, mate, race, gallop and lasso as their ancestors have always done. Out here among cacti and dusty cornfields, the gauchos keep the traditions of the past alive. Gaucho Gaucho is a celebration of a community suspended in time, floating between the past and present, dream and reality.",India Premiere,"U.S. Documentary Special Jury Award for Sound, Sundance Film Festival 2024 I Letterboxd Piazza Grande Award, Locarno International Film Festival 2024","Sundance Film Festival 2024, Locarno International Film Festival 2024, CPH:DOX 2024, Melbourne International Film Festival 2024",GAUCHO GAUCHO - Trailer,"Documentary, Social Impact",Charades,"Gregory Kershaw Bio Image .jpg
Michael Dweck Bio Image .jpg",Gaucho Gaucho,828349_m1729600395.jpeg,https://vimeo.com/1023592368,,,,2024
Docu-Montage,Higher Than Acidic Clouds,Balatar as Abrhaye Acidi,Iran,2024,Persian,70',B&W,Ali Asgari,"Ali Asgari is a prominent figure in international cinema with more than 200 awards to his name. He is an alumnus of Berlinale Talent Campus 2013 and Locarno Summer Academy 2016. His films have been screened at prestigious festivals such as Cannes, Venice and IFFR.","Ali Asgari, Milad Khosravi","Ali Asgari, Ali Shams",Arman Fayaz,Ehsan Vaseghi,"Ali Asgari, Roghayeh Ahmadi, Hajar, Nahid, Zahra","When his film on air pollution in Iran stirs trouble with the authorities, a filmmaker embarks on a turbulent journey through the realms of memory and dream. Ali Asgari’s follow-up to his critically acclaimed Terrestrial Verses (2023) is a hybrid and boundary pushing film that utilizes both documentary and narrative elements in its quest to connect the personal with the political.",Asia Premiere,,International Documentary Film Festival Amsterdam 2024,Higher than Acidic Clouds official Trailer,"Documentary, Hybrids",Seven Springs Pictures,Ali Asgari.jpg,10.jpgg 5.jpg 1.jpg,unavailable,Higher than Acidic Clouds - Presskit .pdfg,,,,2024
Docu-Montage,Mistress Dispeller,,"United States, China",2024,Mandarin,94',Colour,Elizabeth Lo,"Elizabeth holds a BFA from NYU Tisch School of the Arts and an MFA from Stanford University. A filmmaker from Hong Kong, her films have been showcased at festivals such as Sundance, IDFA, SXSW, Tribeca, MoMA, and AFI Fest.","Emma D. Miller, Elizabeth Lo, Maggie Li","Charlotte Munch Bengtsen, Elizabeth Lo",Elizabeth Lo,Charlotte Munch Bengtsen,Wang Zhenxi,"In China, a new industry has emerged devoted to helping couples stay married in the face of infidelity. Wang Zhenxi is part of this growing profession, a “mistress dispeller” who is hired to maintain the bonds of marriage by any means necessary. Offering strikingly intimate access to private dramas usually hidden behind closed doors, Mistress Dispeller explores the ways in which emotion, pragmatism and cultural norms collide to shape romantic relationships in contemporary China.",India Premiere,"Authors Under 40 Award - Best Direction, Venice Film Festival 2024","Venice Film Festival 2024, Toronto International Film Festival 2024, Zurich Film Festival 2024",MISTRESS DISPELLER - Trailer.mp4,"Documentary, Social Impact, Films By Women",The Party Film Sales,DIRECTOR SHOT - Elizabeth Lo Headshot_Photo by Tom Tang 2024.jpgk,Stills,Posters,PressKit (PRESS NOTES).pdf,,,,2024
